{
  "schema": "mondayid.cell-delta.v1",
  "delta_id": "CELL_DELTA_CONVERGENCE_001_OIDC_PORT",
  "cell_id": "convergence-executor",
  "parent_state_id": "mondayid-system:1:d562826",
  "kind": "INTEGRATION",
  "effect": "Port PR46 live-model transport onto the current canonical lineage without creating a parallel host: Vercel OIDC/AI Gateway is preferred, direct OpenAI remains fallback, and serverless health/respond expose/use the same transport resolver.",
  "product_line_patch": {
    "id": "live_model_transport",
    "patch": {
      "state": "PORTED_TO_CANONICAL_PARENT_AWAITING_VERIFICATION",
      "integrated": false,
      "port_ref": "cell/convergence-001-oidc-port",
      "port_head": "436fb75125810cd8bc85955116f0b3611e9d613e"
    }
  },
  "delivery_evidence": null,
  "next_move": {
    "id": "CONVERGENCE_001_VERIFY",
    "action": "VERIFY_OIDC_PORT_ON_EXACT_HEAD_THEN_PROMOTE_OR_QUARANTINE; AFTER_PROMOTION_VERIFY_PRODUCTION_PROVIDER_READBACK",
    "forbidden_substitution": "DO_NOT_CREATE_ANOTHER_PARALLEL_HOST_OR_ARCHITECTURE"
  },
  "receipt": {
    "status": "EXECUTED_READ_BACK_PENDING_VERIFICATION",
    "source_pr": 46,
    "canonical_parent_head": "d562826b9d42c11fa4effffeea5dd57fea0c37ca",
    "port_head": "436fb75125810cd8bc85955116f0b3611e9d613e",
    "files": [
      "platform/apps/host/runtime-server.mjs",
      "platform/api/organism/health.mjs",
      "platform/api/organism/respond.mjs"
    ]
  },
  "created_at": "2026-09-18T19:06:00Z"
}
